<?xml version="1.0"?>
<!DOCTYPE hpc-experiment [
<!-- ******************************************************************** -->
<!-- HPCToolkit Experiment DTD						  -->
<!-- Version 2.0							  -->
<!-- ******************************************************************** -->
<!ELEMENT HPCToolkitExperiment (Header, (SecCallPathProfile|SecFlatProfile)*)>
<!ATTLIST HPCToolkitExperiment
	  version CDATA #REQUIRED>

  <!-- ****************************************************************** -->

  <!-- Info/NV: flexible name-value pairs: (n)ame; (t)ype; (v)alue -->
  <!ELEMENT Info (NV*)>
  <!ATTLIST Info
	    n CDATA #IMPLIED>
  <!ELEMENT NV EMPTY>
  <!ATTLIST NV
	    n CDATA #REQUIRED
	    t CDATA #IMPLIED
	    v CDATA #REQUIRED>

  <!-- ****************************************************************** -->
  <!-- Header								  -->
  <!-- ****************************************************************** -->
  <!ELEMENT Header (Info*)>
  <!ATTLIST Header
	    n CDATA #REQUIRED>

  <!-- ****************************************************************** -->
  <!-- Section Header							  -->
  <!-- ****************************************************************** -->
  <!ELEMENT SecHeader (MetricTable?, LoadModuleTable?, FileTable?, ProcedureTable?, Info*)>

    <!-- MetricTable: (i)d; (n)ame; fmt: format; show -->
    <!ELEMENT MetricTable (Metric)*>

    <!ELEMENT Metric (MetricFormula?, Info?)>
    <!ATTLIST Metric
	      i    CDATA #REQUIRED
	      n    CDATA #REQUIRED
	      fmt  CDATA #IMPLIED
	      show (1|0) "1">

    <!-- MetricFormula represents derived metrics: (frm): formula; (t)ype -->
    <!ELEMENT MetricFormula (Info?)>
    <!ATTLIST MetricFormula
	      frm CDATA #REQUIRED
	      t   CDATA #IMPLIED>

    <!-- Metric data, used in sections: (n)ame [from MetricTable]; (v)alue -->
    <!ELEMENT M EMPTY>
    <!ATTLIST M
	      n CDATA #REQUIRED
	      v CDATA #REQUIRED>

    <!-- LoadModuleTable assigns a short name to a load module -->
    <!ELEMENT LoadModuleTable (LoadModule)*>

    <!ELEMENT LoadModule (Info?)>
    <!ATTLIST LoadModule
	      i CDATA #REQUIRED
	      n CDATA #REQUIRED>

    <!-- FileTable assigns a short name to a file -->
    <!ELEMENT FileTable (File)*>

    <!ELEMENT File (Info?)>
    <!ATTLIST File
	      i CDATA #REQUIRED
	      n CDATA #REQUIRED>

    <!-- ProcedureTable assigns a short name to a procedure -->
    <!ELEMENT ProcedureTable (Procedure)*>

    <!ELEMENT Procedure (Info?)>
    <!ATTLIST Procedure
	      i CDATA #REQUIRED
	      n CDATA #REQUIRED>

  <!-- ****************************************************************** -->
  <!-- Section: Call path profile					  -->
  <!-- ****************************************************************** -->
  <!ELEMENT SecCallPathProfile (SecHeader, SecCallPathProfileData)>
  <!ATTLIST SecCallPathProfile
	    i CDATA #REQUIRED
	    n CDATA #REQUIRED>

    <!ELEMENT SecCallPathProfileData (PF|M)*>
      <!-- Procedure frame -->
      <!--   (i)d: unique identifier for cross referencing -->
      <!--   (s)tatic scope id -->
      <!--   (n)ame: a string or an id in ProcedureTable -->
      <!--   (lm) load module: a string or an id in LoadModuleTable -->
      <!--   (f)ile name: a string or an id in LoadModuleTable -->
      <!--   (l)ine range: "beg-end" (inclusive range) -->
      <!--   (a)lien: whether frame is alien to enclosing P -->
      <!--   (v)ma-range-set: "{[beg-end), [beg-end)...}" -->
      <!ELEMENT PF (PF|Pr|L|C|S|M)*>
      <!ATTLIST PF
		i  CDATA #IMPLIED
		s  CDATA #IMPLIED
		n  CDATA #REQUIRED
		lm CDATA #IMPLIED
		f  CDATA #IMPLIED
		l  CDATA #IMPLIED
		v  CDATA #IMPLIED>
      <!-- Procedure (static): GOAL: replace with 'P' -->
      <!ELEMENT Pr (Pr|L|C|S|M)*>
      <!ATTLIST Pr
                i  CDATA #IMPLIED
		s  CDATA #IMPLIED
                n  CDATA #REQUIRED
		lm CDATA #IMPLIED
		f  CDATA #IMPLIED
                l  CDATA #IMPLIED
		a  (1|0) "0"
		v  CDATA #IMPLIED>
      <!-- Callsite (a special StatementRange) -->
      <!ELEMENT C (PF|M)*>
      <!ATTLIST C
		i CDATA #IMPLIED
		s CDATA #IMPLIED
		l CDATA #IMPLIED
		v CDATA #IMPLIED>

  <!-- ****************************************************************** -->
  <!-- Section: Flat profile						  -->
  <!-- ****************************************************************** -->
  <!ELEMENT SecFlatProfile (SecHeader, SecFlatProfileData)>
  <!ATTLIST SecFlatProfile
	    i CDATA #REQUIRED
	    n CDATA #REQUIRED>

    <!ELEMENT SecFlatProfileData (LM|M)*>
      <!-- Load module: (i)d; (n)ame; (v)ma-range-set -->
      <!ELEMENT LM (F|P|M)*>
      <!ATTLIST LM
                i CDATA #IMPLIED
                n CDATA #REQUIRED
		v CDATA #IMPLIED>
      <!-- File -->
      <!ELEMENT F (P|L|S|M)*>
      <!ATTLIST F
                i CDATA #IMPLIED
                n CDATA #REQUIRED>
      <!-- Procedure (Note 1) -->
      <!ELEMENT P (P|A|L|S|C|M)*>
      <!ATTLIST P
                i CDATA #IMPLIED
                n CDATA #REQUIRED
                l CDATA #IMPLIED
		v CDATA #IMPLIED>
      <!-- Alien (Note 1) -->
      <!ELEMENT A (A|L|S|C|M)*>
      <!ATTLIST A
                i CDATA #IMPLIED
                f CDATA #IMPLIED
                n CDATA #IMPLIED
                l CDATA #IMPLIED
		v CDATA #IMPLIED>
      <!-- Loop (Note 1,2) -->
      <!ELEMENT L (A|L|S|C|M)*>
      <!ATTLIST L
		i CDATA #IMPLIED
		s CDATA #IMPLIED
		l CDATA #IMPLIED
		v CDATA #IMPLIED>
      <!-- Statement (Note 2) -->
      <!ELEMENT S (S|M)*>
      <!ATTLIST S
		i CDATA #IMPLIED
		s CDATA #IMPLIED
		l CDATA #IMPLIED
		v CDATA #IMPLIED>
      <!-- Note 1: Contained Cs may not contain PFs -->
      <!-- Note 2: The 's' attribute is not used for flat profiles -->
]>
<HPCToolkitExperiment version="2.0">
<Header n="FLASH/white dwarf: IBM BG/P, weak 256->8192">
  <Info/>
</Header>
<SecCallPathProfile i="0" n="FLASH/white dwarf: IBM BG/P, weak 256->8192">
<SecHeader>
  <MetricTable>
    <Metric i="0" n="256/WALLCLOCK (us)" show-percent="1">
      <Info><NV n="period" v="5000"/><NV n="flags" v="0x2"/></Info>
    </Metric>
    <Metric i="1" n="8192/WALLCLOCK (us)" show-percent="1">
      <Info><NV n="period" v="5000"/><NV n="flags" v="0x2"/></Info>
    </Metric>
  </MetricTable>
  <LoadModuleTable>
    <LoadModule i="2" n="/gpfs/home/laksono/nathan/Flash-run-wd/weak-256/flash3"/>
  </LoadModuleTable>
  <FileTable>
    <File i="929" n="../../../../src/tool/hpcrun/csproflib.c"/>
    <File i="1494" n="../../../../src/tool/hpcrun/libmonitor_upcalls.c"/>
    <File i="4213" n="../../../../src/tool/hpcrun/unwind/common/ui_tree.c"/>
    <File i="5715" n="../../libmonitor-0.x-r104/src/mpi.c"/>
    <File i="5738" n="../../libmonitor-0.x-r104/src/mpi_comm_f0.c"/>
    <File i="5762" n="../../libmonitor-0.x-r104/src/mpi_final_f0.c"/>
    <File i="5798" n="../../libmonitor-0.x-r104/src/mpi_init_f0.c"/>
    <File i="5833" n="../../libmonitor-0.x-r104/src/pthread.c"/>
    <File i="7990" n="../include/ctype.h"/>
    <File i="9356" n="../sysdeps/posix/isatty.c"/>
    <File i="9792" n="../sysdeps/powerpc/powerpc32/memset.c"/>
    <File i="10158" n="../sysdeps/unix/sysv/linux/fxstat64.c"/>
    <File i="10679" n="../sysdeps/unix/sysv/linux/open64.c"/>
    <File i="11252" n="../sysdeps/unix/sysv/linux/tcgetattr.c"/>
    <File i="11397" n="../sysdeps/unix/sysv/linux/xstat64.c"/>
    <File i="12244" n="/bglhome/usr6/bgbuild/V1R3M0_460_2008-081112P/ppc/bgp/comm/build/dcmf/include/devices/dma/CounterGroup.h"/>
    <File i="12920" n="./src/bgsys/drivers/V1R3M0_460_2008-081112P/ppc/arch/include/spi/kernel_interface.h"/>
    <File i="12962" n="/bglhome/usr6/bgbuild/V1R3M0_460_2008-081112P/ppc/bgp/comm/build/dcmf/include/devices/dma/CounterList.h"/>
    <File i="12977" n="/bglhome/usr6/bgbuild/V1R3M0_460_2008-081112P/ppc/bgp/comm/sys/messaging/devices/prod/dma/CounterGroup.cc"/>
    <File i="13071" n="/bglhome/usr6/bgbuild/V1R3M0_460_2008-081112P/ppc/bgp/comm/build/dcmf/include/devices/dma/CounterList.h"/>
    <File i="13169" n="./src/bgsys/drivers/V1R3M0_460_2008-081112P/ppc/arch/include/spi/DMA_Counter.h"/>
    <File i="13203" n="./src/bgsys/drivers/V1R3M0_460_2008-081112P/ppc/arch/include/spi/DMA_Counter.h"/>
    <File i="13293" n="./src/bgsys/drivers/V1R3M0_460_2008-081112P/ppc/arch/include/spi/kernel_interface.h"/>
    <File i="13741" n="/bglhome/usr6/bgbuild/V1R3M0_460_2008-081112P/ppc/bgp/comm/sys/messaging/devices/prod/dma/CounterGroup.cc"/>
    <File i="13747" n="/bglhome/usr6/bgbuild/V1R3M0_460_2008-081112P/ppc/bgp/comm/build/dcmf/include/devices/dma/CounterList.h"/>
    <File i="13753" n="/bglhome/usr6/bgbuild/V1R3M0_460_2008-081112P/ppc/bgp/comm/build/dcmf/include/devices/dma/CounterList.h"/>
    <File i="13755" n="/bglhome/usr6/bgbuild/V1R3M0_460_2008-081112P/ppc/bgp/comm/build/dcmf/include/devices/dma/CounterList.h"/>
    <File i="13763" n="./src/bgsys/drivers/V1R3M0_460_2008-081112P/ppc/arch/include/spi/DMA_Counter.h"/>
    <File i="13767" n="/bglhome/usr6/bgbuild/V1R3M0_460_2008-081112P/ppc/bgp/comm/build/dcmf/include/devices/dma/CounterList.h"/>
    <File i="13770" n="/bglhome/usr6/bgbuild/V1R3M0_460_2008-081112P/ppc/bgp/comm/build/dcmf/include/devices/dma/CounterList.h"/>
    <File i="13782" n="./src/bgsys/drivers/V1R3M0_460_2008-081112P/ppc/arch/include/spi/DMA_Counter.h"/>
    <File i="13784" n="./src/bgsys/drivers/V1R3M0_460_2008-081112P/ppc/arch/include/spi/DMA_Counter.h"/>
    <File i="13791" n="./src/bgsys/drivers/V1R3M0_460_2008-081112P/ppc/arch/include/bpcore/ppc450_inlines.h"/>
    <File i="13793" n="/bglhome/usr6/bgbuild/V1R3M0_460_2008-081112P/ppc/bgp/comm/build/dcmf/include/devices/dma/CounterClient.h"/>
    <File i="13795" n="/bglhome/usr6/bgbuild/V1R3M0_460_2008-081112P/ppc/bgp/comm/build/dcmf/include/devices/dma/CounterList.h"/>
    <File i="13803" n="/bglhome/usr6/bgbuild/V1R3M0_460_2008-081112P/ppc/bgp/comm/build/dcmf/include/devices/dma/CounterList.h"/>
    <File i="13846" n="./src/bgsys/drivers/V1R3M0_460_2008-081112P/ppc/arch/include/spi/DMA_Counter.h"/>
    <File i="14336" n="/bglhome/usr6/bgbuild/V1R3M0_460_2008-081112P/ppc/bgp/comm/build/dcmf/include/devices/dma/DMAManyToMany.h"/>
    <File i="14341" n="/bglhome/usr6/bgbuild/V1R3M0_460_2008-081112P/ppc/bgp/comm/build/dcmf/include/devices/dma/DMAManyToMany.h"/>
    <File i="14462" n="./src/bgsys/drivers/V1R3M0_460_2008-081112P/ppc/arch/include/spi/DMA_Addressing.h"/>
    <File i="14506" n="./src/bgsys/drivers/V1R3M0_460_2008-081112P/ppc/arch/include/spi/DMA_DescriptorBaseXX.h"/>
    <File i="14508" n="./src/bgsys/drivers/V1R3M0_460_2008-081112P/ppc/arch/include/spi/DMA_DescriptorBaseXX.h"/>
    <File i="14512" n="./src/bgsys/drivers/V1R3M0_460_2008-081112P/ppc/arch/include/spi/DMA_DescriptorBaseXX.h"/>
    <File i="14518" n="./src/bgsys/drivers/V1R3M0_460_2008-081112P/ppc/arch/include/spi/DMA_DescriptorsXX.h"/>
    <File i="14520" n="/bglhome/usr6/bgbuild/V1R3M0_460_2008-081112P/ppc/bgp/comm/sys/messaging/sysdep/Mapping.h"/>
    <File i="14533" n="/bglhome/usr6/bgbuild/V1R3M0_460_2008-081112P/ppc/bgp/comm/build/dcmf/include/devices/dma/DMAManyToMany.h"/>
    <File i="14537" n="./src/bgsys/drivers/V1R3M0_460_2008-081112P/ppc/arch/include/spi/DMA_DescriptorsXX.h"/>
    <File i="14539" n="/bglhome/usr6/bgbuild/V1R3M0_460_2008-081112P/ppc/bgp/comm/build/dcmf/include/devices/dma/DMAManyToMany.h"/>
    <File i="14553" n="./src/bgsys/drivers/V1R3M0_460_2008-081112P/ppc/arch/include/spi/DMA_DescriptorsXX.h"/>
    <File i="14562" n="/bglhome/usr6/bgbuild/V1R3M0_460_2008-081112P/ppc/bgp/comm/build/dcmf/include/devices/dma/DMAMessage.h"/>
    <File i="14573" n="/bglhome/usr6/bgbuild/V1R3M0_460_2008-081112P/ppc/bgp/comm/build/dcmf/include/devices/dma/DMAMessage.h"/>
    <File i="14583" n="/bglhome/usr6/bgbuild/V1R3M0_460_2008-081112P/ppc/bgp/comm/build/dcmf/include/devices/dma/DMAMulticast.h"/>
    <File i="14656" n="/bglhome/usr6/bgbuild/V1R3M0_460_2008-081112P/ppc/bgp/comm/sys/messaging/sysdep/Mapping.h"/>
    <File i="14660" n="/bglhome/usr6/bgbuild/V1R3M0_460_2008-081112P/ppc/bgp/comm/sys/messaging/sysdep/Mapping.h"/>
    <File i="14676" n="/bglhome/usr6/bgbuild/V1R3M0_460_2008-081112P/ppc/bgp/comm/build/dcmf/include/devices/dma/ResourceMgr.h"/>
    <File i="14699" n="./src/bgsys/drivers/V1R3M0_460_2008-081112P/ppc/arch/include/spi/DMA_DescriptorBaseXX.h"/>
    <File i="14713" n="./src/bgsys/drivers/V1R3M0_460_2008-081112P/ppc/arch/include/spi/DMA_DescriptorsXX.h"/>
    <File i="14715" n="/bglhome/usr6/bgbuild/V1R3M0_460_2008-081112P/ppc/bgp/comm/build/dcmf/include/devices/dma/DMAMulticast.h"/>
    <File i="14721" n="/bglhome/usr6/bgbuild/V1R3M0_460_2008-081112P/ppc/bgp/comm/build/dcmf/include/devices/dma/DMAMulticast.h"/>
    <File i="14736" n="./src/bgsys/drivers/V1R3M0_460_2008-081112P/ppc/arch/include/spi/DMA_DescriptorsXX.h"/>
    <File i="14738" n="/bglhome/usr6/bgbuild/V1R3M0_460_2008-081112P/ppc/bgp/comm/build/dcmf/include/devices/dma/DMAMulticast.h"/>
    <File i="14751" n="./src/bgsys/drivers/V1R3M0_460_2008-081112P/ppc/arch/include/spi/DMA_Descriptors.h"/>
    <File i="14759" n="/bglhome/usr6/bgbuild/V1R3M0_460_2008-081112P/ppc/bgp/comm/build/dcmf/include/devices/dma/DMAMulticast.h"/>
    <File i="15297" n="/bglhome/usr6/bgbuild/V1R3M0_460_2008-081112P/ppc/bgp/comm/build/dcmf/include/devices/dma/GenericCounterClient.h"/>
    <File i="15313" n="/bglhome/usr6/bgbuild/V1R3M0_460_2008-081112P/ppc/bgp/comm/build/dcmf/include/devices/dma/Get.h"/>
    <File i="15335" n="/bglhome/usr6/bgbuild/V1R3M0_460_2008-081112P/ppc/bgp/comm/build/dcmf/include/devices/dma/Get.h"/>
    <File i="15361" n="./src/bgsys/drivers/V1R3M0_460_2008-081112P/ppc/arch/include/spi/DMA_Counter.h"/>
    <File i="15472" n="/bglhome/usr6/bgbuild/V1R3M0_460_2008-081112P/ppc/bgp/comm/build/dcmf/include/devices/dma/InjFifoGroup.h"/>
    <File i="15768" n="./src/bgsys/drivers/V1R3M0_460_2008-081112P/ppc/arch/include/spi/DMA_DescriptorsXX.h"/>
    <File i="15770" n="./src/bgsys/drivers/V1R3M0_460_2008-081112P/ppc/arch/include/spi/DMA_Fifo.h"/>
    <File i="15777" n="/bglhome/usr6/bgbuild/V1R3M0_460_2008-081112P/ppc/bgp/comm/build/dcmf/include/devices/dma/InjFifoGroup.h"/>
    <File i="15785" n="./src/bgsys/drivers/V1R3M0_460_2008-081112P/ppc/arch/include/spi/DMA_DescriptorsXX.h"/>
    <File i="15787" n="./src/bgsys/drivers/V1R3M0_460_2008-081112P/ppc/arch/include/spi/DMA_DescriptorsXX.h"/>
    <File i="15791" n="./src/bgsys/drivers/V1R3M0_460_2008-081112P/ppc/arch/include/spi/DMA_Fifo.h"/>
    <File i="15794" n="./src/bgsys/drivers/V1R3M0_460_2008-081112P/ppc/arch/include/spi/DMA_DescriptorsXX.h"/>
    <File i="15801" n="./src/bgsys/drivers/V1R3M0_460_2008-081112P/ppc/arch/include/spi/DMA_Fifo.h"/>
    <File i="15809" n="./src/bgsys/drivers/V1R3M0_460_2008-081112P/ppc/arch/include/spi/DMA_DescriptorsXX.h"/>
    <File i="15817" n="./src/bgsys/drivers/V1R3M0_460_2008-081112P/ppc/arch/include/spi/DMA_InjFifo.h"/>
    <File i="15824" n="./src/bgsys/drivers/V1R3M0_460_2008-081112P/ppc/arch/include/spi/DMA_InjFifo.h"/>
    <File i="15832" n="./src/bgsys/drivers/V1R3M0_460_2008-081112P/ppc/arch/include/spi/DMA_InjFifo.h"/>
    <File i="15845" n="/bglhome/usr6/bgbuild/V1R3M0_460_2008-081112P/ppc/bgp/comm/sys/messaging/devices/prod/dma/InjFifoGroup.cc"/>
    <File i="15851" n="./src/bgsys/drivers/V1R3M0_460_2008-081112P/ppc/arch/include/spi/DMA_Fifo.h"/>
    <File i="15855" n="./src/bgsys/drivers/V1R3M0_460_2008-081112P/ppc/arch/include/spi/DMA_Fifo.h"/>
    <File i="15862" n="./src/bgsys/drivers/V1R3M0_460_2008-081112P/ppc/arch/include/spi/DMA_DescriptorsXX.h"/>
    <File i="15866" n="./src/bgsys/drivers/V1R3M0_460_2008-081112P/ppc/arch/include/spi/DMA_Fifo.h"/>
    <File i="15869" n="./src/bgsys/drivers/V1R3M0_460_2008-081112P/ppc/arch/include/spi/DMA_DescriptorsXX.h"/>
    <File i="15875" n="./src/bgsys/drivers/V1R3M0_460_2008-081112P/ppc/arch/include/spi/DMA_InjFifo.h"/>
    <File i="15878" n="/bglhome/usr6/bgbuild/V1R3M0_460_2008-081112P/ppc/bgp/comm/build/dcmf/include/devices/dma/InjFifoGroup.h"/>
    <File i="15880" n="./src/bgsys/drivers/V1R3M0_460_2008-081112P/ppc/arch/include/spi/DMA_InjFifo.h"/>
    <File i="15930" n="/bglhome/usr6/bgbuild/V1R3M0_460_2008-081112P/ppc/bgp/comm/build/dcmf/include/devices/dma/RecFifoGroup.h"/>
    <File i="16019" n="/bglhome/usr6/bgbuild/V1R3M0_460_2008-081112P/ppc/bgp/comm/sys/messaging/devices/prod/dma/RecFifoGroup.cc"/>
    <File i="16348" n="/bglhome/usr6/bgbuild/V1R3M0_460_2008-081112P/ppc/bgp/comm/build/dcmf/include/devices/gi/Device.h"/>
    <File i="16420" n="/bglhome/usr6/bgbuild/V1R3M0_460_2008-081112P/ppc/bgp/comm/sys/messaging/devices/prod/gi/Device.cc"/>
    <File i="16554" n="/bglhome/usr6/bgbuild/V1R3M0_460_2008-081112P/ppc/bgp/comm/build/dcmf/include/devices/lockbox/Message.h"/>
    <File i="16580" n="/bglhome/usr6/bgbuild/V1R3M0_460_2008-081112P/ppc/bgp/comm/sys/messaging/sysdep/LockManager.h"/>
    <File i="16789" n="/bglhome/usr6/bgbuild/V1R3M0_460_2008-081112P/ppc/bgp/comm/build/dcmf/include/devices/workqueue/LocalBcastWQMessage.h"/>
    <File i="16812" n="/bglhome/usr6/bgbuild/V1R3M0_460_2008-081112P/ppc/bgp/comm/build/dcmf/include/devices/workqueue/WorkQueue.h"/>
    <File i="16888" n="/bglhome/usr6/bgbuild/V1R3M0_460_2008-081112P/ppc/bgp/comm/build/dcmf/include/devices/workqueue/LocalReduceWQMessage.h"/>
    <File i="16960" n="/bglhome/usr6/bgbuild/V1R3M0_460_2008-081112P/ppc/bgp/comm/build/dcmf/include/devices/workqueue/WorkQueue.h"/>
    <File i="16984" n="/bglhome/usr6/bgbuild/V1R3M0_460_2008-081112P/ppc/bgp/comm/build/dcmf/include/devices/workqueue/WorkQueue.h"/>
    <File i="17495" n="/bglhome/usr6/bgbuild/V1R3M0_460_2008-081112P/ppc/bgp/comm/build/dcmf/include/protocols/multisend/dma/DPutMultiSend.h"/>
    <File i="17646" n="/bglhome/usr6/bgbuild/V1R3M0_460_2008-081112P/ppc/bgp/comm/build/dcmf/include/devices/dma/GenericCounterClient.h"/>
    <File i="17655" n="/bglhome/usr6/bgbuild/V1R3M0_460_2008-081112P/ppc/bgp/comm/build/dcmf/include/protocols/multisend/dma/DPutMultiSend.h"/>
    <File i="17657" n="/bglhome/usr6/bgbuild/V1R3M0_460_2008-081112P/ppc/bgp/comm/build/dcmf/include/protocols/multisend/dma/DPutMultiSend.h"/>
    <File i="17664" n="/bglhome/usr6/bgbuild/V1R3M0_460_2008-081112P/ppc/bgp/comm/build/dcmf/include/devices/dma/CounterClient.h"/>
    <File i="17673" n="/bglhome/usr6/bgbuild/V1R3M0_460_2008-081112P/ppc/bgp/comm/sys/messaging/protocols/Protocol.h"/>
    <File i="17677" n="./src/bgsys/drivers/V1R3M0_460_2008-081112P/ppc/arch/include/spi/DMA_DescriptorBaseXX.h"/>
    <File i="17706" n="./src/bgsys/drivers/V1R3M0_460_2008-081112P/ppc/arch/include/spi/DMA_Addressing.h"/>
    <File i="17731" n="/bglhome/usr6/bgbuild/V1R3M0_460_2008-081112P/ppc/bgp/comm/build/dcmf/include/devices/dma/DMAMulticast.h"/>
    <File i="17743" n="/bglhome/usr6/bgbuild/V1R3M0_460_2008-081112P/ppc/bgp/comm/build/dcmf/include/devices/dma/DMAMulticast.h"/>
    <File i="17758" n="./src/bgsys/drivers/V1R3M0_460_2008-081112P/ppc/arch/include/spi/DMA_Addressing.h"/>
    <File i="17761" n="./src/bgsys/drivers/V1R3M0_460_2008-081112P/ppc/arch/include/spi/DMA_DescriptorBaseXX.h"/>
    <File i="17766" n="/bglhome/usr6/bgbuild/V1R3M0_460_2008-081112P/ppc/bgp/comm/build/dcmf/include/devices/dma/Device.h"/>
    <File i="17773" n="./src/bgsys/drivers/V1R3M0_460_2008-081112P/ppc/arch/include/spi/DMA_DescriptorsXX.h"/>
    <File i="17775" n="./src/bgsys/drivers/V1R3M0_460_2008-081112P/ppc/arch/include/spi/DMA_DescriptorsXX.h"/>
    <File i="17789" n="./src/bgsys/drivers/V1R3M0_460_2008-081112P/ppc/arch/include/spi/DMA_Descriptors.h"/>
    <File i="17829" n="/bglhome/usr6/bgbuild/V1R3M0_460_2008-081112P/ppc/bgp/comm/sys/messaging/Util.h"/>
    <File i="17841" n="/bglhome/usr6/bgbuild/V1R3M0_460_2008-081112P/ppc/bgp/comm/build/dcmf/include/protocols/multisend/dma/DPutMultiSend.h"/>
    <File i="17879" n="/bglhome/usr6/bgbuild/V1R3M0_460_2008-081112P/ppc/bgp/comm/build/dcmf/include/protocols/multisend/dma/MFifoManyToManyFactory.h"/>
    <File i="17965" n="/bglhome/usr6/bgbuild/V1R3M0_460_2008-081112P/ppc/bgp/comm/build/dcmf/include/devices/dma/Device.h"/>
    <File i="18489" n="/bglhome/usr6/bgbuild/V1R3M0_460_2008-081112P/ppc/bgp/comm/build/dcmf/include/protocols/multisend/dma/ManyToManyProtocol.h"/>
    <File i="18527" n="/bglhome/usr6/bgbuild/V1R3M0_460_2008-081112P/ppc/bgp/comm/build/dcmf/include/devices/dma/DMAManyToMany.h"/>
    <File i="18545" n="/bglhome/usr6/bgbuild/V1R3M0_460_2008-081112P/ppc/bgp/comm/build/dcmf/include/protocols/multisend/dma/ShortMulticast.h"/>
    <File i="18560" n="/bglhome/usr6/bgbuild/V1R3M0_460_2008-081112P/ppc/bgp/comm/build/dcmf/include/protocols/multisend/dma/MemFifoUtil.h"/>
    <File i="18582" n="/bglhome/usr6/bgbuild/V1R3M0_460_2008-081112P/ppc/bgp/comm/build/dcmf/include/protocols/multisend/gi/GIMultiSend.h"/>
    <File i="18658" n="/bglhome/usr6/bgbuild/V1R3M0_460_2008-081112P/ppc/bgp/comm/build/dcmf/include/protocols/multisend/tree/TreeAllreduce.h"/>
    <File i="20291" n="/bglhome/usr6/bgbuild/V1R3M0_460_2008-081112P/ppc/bgp/comm/lib/dev/mpich2/src/binding/f77/allgatherf.c"/>
    <File i="20309" n="/bglhome/usr6/bgbuild/V1R3M0_460_2008-081112P/ppc/bgp/comm/lib/dev/mpich2/src/binding/f77/allreducef.c"/>
    <File i="20318" n="/bglhome/usr6/bgbuild/V1R3M0_460_2008-081112P/ppc/bgp/comm/lib/dev/mpich2/src/binding/f77/alltoallf.c"/>
    <File i="20324" n="/bglhome/usr6/bgbuild/V1R3M0_460_2008-081112P/ppc/bgp/comm/lib/dev/mpich2/src/binding/f77/alltoallvf.c"/>
    <File i="20330" n="/bglhome/usr6/bgbuild/V1R3M0_460_2008-081112P/ppc/bgp/comm/lib/dev/mpich2/src/binding/f77/barrierf.c"/>
    <File i="20336" n="/bglhome/usr6/bgbuild/V1R3M0_460_2008-081112P/ppc/bgp/comm/lib/dev/mpich2/src/binding/f77/bcastf.c"/>
    <File i="20342" n="/bglhome/usr6/bgbuild/V1R3M0_460_2008-081112P/ppc/bgp/comm/lib/dev/mpich2/src/binding/f77/comm_rankf.c"/>
    <File i="20348" n="/bglhome/usr6/bgbuild/V1R3M0_460_2008-081112P/ppc/bgp/comm/lib/dev/mpich2/src/binding/f77/comm_sizef.c"/>
    <File i="20374" n="/bglhome/usr6/bgbuild/V1R3M0_460_2008-081112P/ppc/bgp/comm/lib/dev/mpich2/src/binding/f77/finalizef.c"/>
    <File i="20389" n="/bglhome/usr6/bgbuild/V1R3M0_460_2008-081112P/ppc/bgp/comm/lib/dev/mpich2/src/binding/f77/initf.c"/>
    <File i="20432" n="/bglhome/usr6/bgbuild/V1R3M0_460_2008-081112P/ppc/bgp/comm/lib/dev/mpich2/src/binding/f77/recvf.c"/>
    <File i="20441" n="/bglhome/usr6/bgbuild/V1R3M0_460_2008-081112P/ppc/bgp/comm/lib/dev/mpich2/src/binding/f77/reducef.c"/>
    <File i="20450" n="/bglhome/usr6/bgbuild/V1R3M0_460_2008-081112P/ppc/bgp/comm/lib/dev/mpich2/src/binding/f77/scanf.c"/>
    <File i="20465" n="/bglhome/usr6/bgbuild/V1R3M0_460_2008-081112P/ppc/bgp/comm/lib/dev/mpich2/src/binding/f77/sendrecvf.c"/>
    <File i="20486" n="/bglhome/usr6/bgbuild/V1R3M0_460_2008-081112P/ppc/bgp/comm/lib/dev/mpich2/src/binding/f77/sndrcvrplf.c"/>
    <File i="20495" n="/bglhome/usr6/bgbuild/V1R3M0_460_2008-081112P/ppc/bgp/comm/lib/dev/mpich2/src/binding/f77/ssendf.c"/>
    <File i="20565" n="/bglhome/usr6/bgbuild/V1R3M0_460_2008-081112P/ppc/bgp/comm/lib/dev/mpich2/src/binding/f77/waitallf.c"/>
    <File i="20952" n="/bglhome/usr6/bgbuild/V1R3M0_460_2008-081112P/ppc/bgp/comm/lib/dev/mpich2/src/mpi/coll/allgather.c"/>
    <File i="21557" n="/bglhome/usr6/bgbuild/V1R3M0_460_2008-081112P/ppc/bgp/comm/lib/dev/mpich2/src/mpi/coll/allreduce.c"/>
    <File i="21830" n="/bglhome/usr6/bgbuild/V1R3M0_460_2008-081112P/ppc/bgp/comm/lib/dev/mpich2/src/mpi/coll/alltoall.c"/>
    <File i="22084" n="/bglhome/usr6/bgbuild/V1R3M0_460_2008-081112P/ppc/bgp/comm/lib/dev/mpich2/src/mpi/coll/alltoallv.c"/>
    <File i="22445" n="/bglhome/usr6/bgbuild/V1R3M0_460_2008-081112P/ppc/bgp/comm/lib/dev/mpich2/src/mpi/coll/barrier.c"/>
    <File i="22557" n="/bglhome/usr6/bgbuild/V1R3M0_460_2008-081112P/ppc/bgp/comm/lib/dev/mpich2/src/mpi/coll/bcast.c"/>
    <File i="23506" n="/bglhome/usr6/bgbuild/V1R3M0_460_2008-081112P/ppc/bgp/comm/lib/dev/mpich2/src/mpi/coll/helper_fns.c"/>
    <File i="23587" n="/bglhome/usr6/bgbuild/V1R3M0_460_2008-081112P/ppc/bgp/comm/lib/dev/mpich2/src/mpi/coll/helper_fns.c"/>
    <File i="24535" n="/bglhome/usr6/bgbuild/V1R3M0_460_2008-081112P/ppc/bgp/comm/lib/dev/mpich2/src/mpi/coll/opsum.c"/>
    <File i="25141" n="/bglhome/usr6/bgbuild/V1R3M0_460_2008-081112P/ppc/bgp/comm/lib/dev/mpich2/src/mpi/coll/reduce.c"/>
    <File i="25523" n="/bglhome/usr6/bgbuild/V1R3M0_460_2008-081112P/ppc/bgp/comm/lib/dev/mpich2/src/mpi/coll/scan.c"/>
    <File i="26250" n="/bglhome/usr6/bgbuild/V1R3M0_460_2008-081112P/ppc/bgp/comm/lib/dev/mpich2/src/mpi/comm/comm_rank.c"/>
    <File i="26274" n="/bglhome/usr6/bgbuild/V1R3M0_460_2008-081112P/ppc/bgp/comm/lib/dev/mpich2/src/mpi/comm/comm_size.c"/>
    <File i="26476" n="/bglhome/usr6/bgbuild/V1R3M0_460_2008-081112P/ppc/bgp/comm/lib/dev/mpich2/src/mpi/comm/commutil.c"/>
    <File i="26798" n="/bglhome/usr6/bgbuild/V1R3M0_460_2008-081112P/ppc/bgp/comm/lib/dev/mpich2/src/mpi/datatype/pack.c"/>
    <File i="26874" n="/bglhome/usr6/bgbuild/V1R3M0_460_2008-081112P/ppc/bgp/comm/lib/dev/mpich2/src/mpi/datatype/pack_size.c"/>
    <File i="28623" n="/bglhome/usr6/bgbuild/V1R3M0_460_2008-081112P/ppc/bgp/comm/lib/dev/mpich2/src/mpi/init/finalize.c"/>
    <File i="28688" n="/bglhome/usr6/bgbuild/V1R3M0_460_2008-081112P/ppc/bgp/comm/lib/dev/mpich2/src/mpi/init/init.c"/>
    <File i="28722" n="/bglhome/usr6/bgbuild/V1R3M0_460_2008-081112P/ppc/bgp/comm/lib/dev/mpich2/src/mpi/init/initthread.c"/>
    <File i="28966" n="/bglhome/usr6/bgbuild/V1R3M0_460_2008-081112P/ppc/bgp/comm/lib/dev/mpich2/src/mpi/pt2pt/mpir_request.c"/>
    <File i="29171" n="/bglhome/usr6/bgbuild/V1R3M0_460_2008-081112P/ppc/bgp/comm/lib/dev/mpich2/src/mpi/pt2pt/recv.c"/>
    <File i="29311" n="/bglhome/usr6/bgbuild/V1R3M0_460_2008-081112P/ppc/bgp/comm/lib/dev/mpich2/src/mpi/pt2pt/sendrecv.c"/>
    <File i="29413" n="/bglhome/usr6/bgbuild/V1R3M0_460_2008-081112P/ppc/bgp/comm/lib/dev/mpich2/src/mpi/pt2pt/sendrecv_rep.c"/>
    <File i="29516" n="/bglhome/usr6/bgbuild/V1R3M0_460_2008-081112P/ppc/bgp/comm/lib/dev/mpich2/src/mpi/pt2pt/ssend.c"/>
    <File i="29633" n="/bglhome/usr6/bgbuild/V1R3M0_460_2008-081112P/ppc/bgp/comm/lib/dev/mpich2/src/mpi/pt2pt/waitall.c"/>
    <File i="31157" n="/bglhome/usr6/bgbuild/V1R3M0_460_2008-081112P/ppc/bgp/comm/lib/dev/mpich2/src/mpid/common/datatype/dataloop/segment.c"/>
    <File i="31227" n="/bglhome/usr6/bgbuild/V1R3M0_460_2008-081112P/ppc/bgp/comm/lib/dev/mpich2/src/mpid/common/datatype/dataloop/segment.c"/>
    <File i="31230" n="/bglhome/usr6/bgbuild/V1R3M0_460_2008-081112P/ppc/bgp/comm/lib/dev/mpich2/src/mpid/common/datatype/dataloop/segment.c"/>
    <File i="31269" n="/bglhome/usr6/bgbuild/V1R3M0_460_2008-081112P/ppc/bgp/comm/lib/dev/mpich2/src/mpid/common/datatype/dataloop/segment.c"/>
    <File i="31276" n="/bglhome/usr6/bgbuild/V1R3M0_460_2008-081112P/ppc/bgp/comm/lib/dev/mpich2/src/mpid/common/datatype/dataloop/segment.c"/>
    <File i="31282" n="/bglhome/usr6/bgbuild/V1R3M0_460_2008-081112P/ppc/bgp/comm/lib/dev/mpich2/src/mpid/common/datatype/dataloop/segment.c"/>
    <File i="31487" n="/bglhome/usr6/bgbuild/V1R3M0_460_2008-081112P/ppc/bgp/comm/lib/dev/mpich2/src/mpid/common/datatype/dataloop/segment_ops.c"/>
    <File i="32769" n="/bglhome/usr6/bgbuild/V1R3M0_460_2008-081112P/ppc/bgp/comm/lib/dev/mpich2/src/mpid/dcmfd/src/coll/allgather/allgather_algorithms.c"/>
    <File i="32919" n="/bglhome/usr6/bgbuild/V1R3M0_460_2008-081112P/ppc/bgp/comm/lib/dev/mpich2/src/mpid/dcmfd/src/coll/allgather/mpido_allgather.c"/>
    <File i="33297" n="/bglhome/usr6/bgbuild/V1R3M0_460_2008-081112P/ppc/bgp/comm/lib/dev/mpich2/src/mpid/dcmfd/src/coll/allreduce/allreduce_algorithms.c"/>
    <File i="33447" n="/bglhome/usr6/bgbuild/V1R3M0_460_2008-081112P/ppc/bgp/comm/lib/dev/mpich2/src/mpid/dcmfd/src/coll/allreduce/mpido_allreduce.c"/>
    <File i="33554" n="/bglhome/usr6/bgbuild/V1R3M0_460_2008-081112P/ppc/bgp/comm/lib/dev/mpich2/src/mpid/dcmfd/src/coll/alltoall/alltoall_algorithms.c"/>
    <File i="33608" n="/bglhome/usr6/bgbuild/V1R3M0_460_2008-081112P/ppc/bgp/comm/lib/dev/mpich2/src/mpid/dcmfd/src/coll/alltoall/mpido_alltoall.c"/>
    <File i="33690" n="/bglhome/usr6/bgbuild/V1R3M0_460_2008-081112P/ppc/bgp/comm/lib/dev/mpich2/src/mpid/dcmfd/src/coll/alltoallv/alltoallv_algorithms.c"/>
    <File i="33708" n="/bglhome/usr6/bgbuild/V1R3M0_460_2008-081112P/ppc/bgp/comm/lib/dev/mpich2/src/mpid/dcmfd/src/coll/alltoallv/mpido_alltoallv.c"/>
    <File i="33804" n="/bglhome/usr6/bgbuild/V1R3M0_460_2008-081112P/ppc/bgp/comm/lib/dev/mpich2/src/mpid/dcmfd/src/coll/barrier/barrier_algorithms.c"/>
    <File i="33840" n="/bglhome/usr6/bgbuild/V1R3M0_460_2008-081112P/ppc/bgp/comm/lib/dev/mpich2/src/mpid/dcmfd/src/coll/barrier/mpido_barrier.c"/>
    <File i="33853" n="/bglhome/usr6/bgbuild/V1R3M0_460_2008-081112P/ppc/bgp/comm/lib/dev/mpich2/src/mpid/dcmfd/src/coll/bcast/bcast_algorithms.c"/>
    <File i="34059" n="/bglhome/usr6/bgbuild/V1R3M0_460_2008-081112P/ppc/bgp/comm/lib/dev/mpich2/src/mpid/dcmfd/src/coll/bcast/mpido_bcast.c"/>
    <File i="34187" n="/bglhome/usr6/bgbuild/V1R3M0_460_2008-081112P/ppc/bgp/comm/lib/dev/mpich2/src/mpid/dcmfd/src/coll/coll_utils.c"/>
    <File i="34419" n="/bglhome/usr6/bgbuild/V1R3M0_460_2008-081112P/ppc/bgp/comm/lib/dev/mpich2/src/mpid/dcmfd/src/coll/reduce/mpido_reduce.c"/>
    <File i="34484" n="/bglhome/usr6/bgbuild/V1R3M0_460_2008-081112P/ppc/bgp/comm/lib/dev/mpich2/src/mpid/dcmfd/src/coll/reduce/reduce_algorithms.c"/>
    <File i="35397" n="/bglhome/usr6/bgbuild/V1R3M0_460_2008-081112P/ppc/bgp/comm/lib/dev/mpich2/src/mpid/dcmfd/src/coll/unimpl.c"/>
    <File i="36798" n="/bglhome/usr6/bgbuild/V1R3M0_460_2008-081112P/ppc/bgp/comm/lib/dev/mpich2/src/mpid/dcmfd/src/impl/mpid_buffer.c"/>
    <File i="36869" n="/bglhome/usr6/bgbuild/V1R3M0_460_2008-081112P/ppc/bgp/comm/lib/dev/mpich2/src/mpid/dcmfd/src/impl/mpid_recvq.c"/>
    <File i="37046" n="/bglhome/usr6/bgbuild/V1R3M0_460_2008-081112P/ppc/bgp/comm/lib/dev/mpich2/src/mpid/dcmfd/src/impl/mpid_request.c"/>